{
  "$schema": "../../../NiziKit/Assets/Serde/Schemas/niziscene.schema.json",
  "name": "Viking Showcase",
  "assetPacks": ["Packs/Viking"],
  "camera": {
    "name": "Main Camera",
    "position": [0, 15, -30],
    "fieldOfView": 0.785398,
    "nearPlane": 0.1,
    "farPlane": 1000,
    "controller": {
      "lookAt": [0, 2, 0]
    }
  },
  "lights": [
    {
      "type": "directional",
      "name": "Sun",
      "direction": [0.3, -0.8, 0.4],
      "color": [1.0, 0.95, 0.9],
      "intensity": 0.8,
      "castsShadows": true
    }
  ],
  "objects": [
    {
      "name": "Character_Viking",
      "position": [0, 0, 0],
      "scale": [1, 1, 1],
      "components": [
        { "type": "mesh", "mesh": "viking:characters/0" },
        { "type": "material", "material": "viking:VikingRealmAlt" }
      ]
    },
    {
      "name": "Character_Viking2",
      "position": [3, 0, 0],
      "scale": [1, 1, 1],
      "components": [
        { "type": "mesh", "mesh": "viking:characters/1" },
        { "type": "material", "material": "viking:VikingRealmAlt" }
      ]
    },
    {
      "name": "Character_Viking3",
      "position": [-3, 0, 0],
      "scale": [1, 1, 1],
      "components": [
        { "type": "mesh", "mesh": "viking:characters/2" },
        { "type": "material", "material": "viking:VikingRealmAlt" }
      ]
    },

    {
      "name": "Boat",
      "position": [15, 0, 10],
      "rotation": [0, -30, 0],
      "scale": [1, 1, 1],
      "components": [
        { "type": "mesh", "mesh": "viking:boat-large/0" },
        { "type": "material", "material": "viking:VikingRealmAlt" }
      ]
    },
    {
      "name": "SmallBoat",
      "position": [-15, 0, 8],
      "rotation": [0, 45, 0],
      "scale": [1, 1, 1],
      "components": [
        { "type": "mesh", "mesh": "viking:boat-small/0" },
        { "type": "material", "material": "viking:VikingRealmAlt" }
      ]
    },
    {
      "name": "Cart",
      "position": [-8, 0, -5],
      "rotation": [0, 20, 0],
      "scale": [1, 1, 1],
      "components": [
        { "type": "mesh", "mesh": "viking:cart/0" },
        { "type": "material", "material": "viking:VikingRealmAlt" }
      ]
    },

    {
      "name": "Table",
      "position": [8, 0, -3],
      "scale": [1, 1, 1],
      "components": [
        { "type": "mesh", "mesh": "viking:table/0" },
        { "type": "material", "material": "viking:VikingRealmAlt" }
      ]
    },
    {
      "name": "Chair1",
      "position": [7, 0, -2],
      "rotation": [0, 90, 0],
      "scale": [1, 1, 1],
      "components": [
        { "type": "mesh", "mesh": "viking:chair/0" },
        { "type": "material", "material": "viking:VikingRealmAlt" }
      ]
    },
    {
      "name": "Chair2",
      "position": [9, 0, -2],
      "rotation": [0, -90, 0],
      "scale": [1, 1, 1],
      "components": [
        { "type": "mesh", "mesh": "viking:chair/0" },
        { "type": "material", "material": "viking:VikingRealmAlt" }
      ]
    },
    {
      "name": "Bench",
      "position": [8, 0, -5],
      "scale": [1, 1, 1],
      "components": [
        { "type": "mesh", "mesh": "viking:bench/0" },
        { "type": "material", "material": "viking:VikingRealmAlt" }
      ]
    },

    {
      "name": "Anvil",
      "position": [-6, 0, 3],
      "scale": [1, 1, 1],
      "components": [
        { "type": "mesh", "mesh": "viking:anvil/0" },
        { "type": "material", "material": "viking:VikingRealmAlt" }
      ]
    },
    {
      "name": "Barrel2",
      "position": [5, 0, 5],
      "scale": [1, 1, 1],
      "components": [
        { "type": "mesh", "mesh": "viking:barrel2/0" },
        { "type": "material", "material": "viking:VikingRealmAlt" }
      ]
    },
    {
      "name": "Barrel",
      "position": [6, 0, 6],
      "scale": [1, 1, 1],
      "components": [
        { "type": "mesh", "mesh": "viking:barrel/0" },
        { "type": "material", "material": "viking:VikingRealmAlt" }
      ]
    },

    {
      "name": "Firepit",
      "position": [0, 0, 8],
      "scale": [1, 1, 1],
      "components": [
        { "type": "mesh", "mesh": "viking:firepit/0" },
        { "type": "material", "material": "viking:VikingRealmAlt" }
      ]
    },
    {
      "name": "Flag",
      "position": [10, 0, 3],
      "scale": [1, 1, 1],
      "components": [
        { "type": "mesh", "mesh": "viking:flag/0" },
        { "type": "material", "material": "viking:VikingRealmAlt" }
      ]
    },

    {
      "name": "Axe",
      "position": [-5, 1, 3],
      "rotation": [0, 0, 45],
      "scale": [1, 1, 1],
      "components": [
        { "type": "mesh", "mesh": "viking:axe/0" },
        { "type": "material", "material": "viking:VikingRealmAlt" }
      ]
    },
    {
      "name": "Sword",
      "position": [-4, 0.5, 3.5],
      "rotation": [-30, 0, 0],
      "scale": [1, 1, 1],
      "components": [
        { "type": "mesh", "mesh": "viking:sword/0" },
        { "type": "material", "material": "viking:VikingRealmAlt" }
      ]
    },
    {
      "name": "Shield",
      "position": [-5.5, 0.8, 2],
      "rotation": [80, 0, 0],
      "scale": [1, 1, 1],
      "components": [
        { "type": "mesh", "mesh": "viking:shield/0" },
        { "type": "material", "material": "viking:VikingRealmAlt" }
      ]
    },
    {
      "name": "Hammer",
      "position": [-6.5, 0.3, 3],
      "scale": [1, 1, 1],
      "components": [
        { "type": "mesh", "mesh": "viking:hammer/0" },
        { "type": "material", "material": "viking:VikingRealmAlt" }
      ]
    },
    {
      "name": "Spear",
      "position": [-7, 0, 4],
      "rotation": [70, 0, 0],
      "scale": [1, 1, 1],
      "components": [
        { "type": "mesh", "mesh": "viking:spear/0" },
        { "type": "material", "material": "viking:VikingRealmAlt" }
      ]
    },

    {
      "name": "Tree1",
      "position": [-20, 0, 0],
      "scale": [1, 1, 1],
      "components": [
        { "type": "mesh", "mesh": "viking:tree-pine/0" },
        { "type": "material", "material": "viking:VikingRealmAlt" }
      ]
    },
    {
      "name": "Tree2",
      "position": [20, 0, 5],
      "scale": [1, 1, 1],
      "components": [
        { "type": "mesh", "mesh": "viking:tree-pine/0" },
        { "type": "material", "material": "viking:VikingRealmAlt" }
      ]
    },
    {
      "name": "Tree3",
      "position": [-18, 0, 12],
      "scale": [1.2, 1.2, 1.2],
      "components": [
        { "type": "mesh", "mesh": "viking:tree-pine/0" },
        { "type": "material", "material": "viking:VikingRealmAlt" }
      ]
    },
    {
      "name": "Rock1",
      "position": [12, 0, -8],
      "scale": [1, 1, 1],
      "components": [
        { "type": "mesh", "mesh": "viking:rock/0" },
        { "type": "material", "material": "viking:VikingRealmAlt" }
      ]
    },
    {
      "name": "Rock2",
      "position": [-12, 0, -6],
      "rotation": [0, 45, 0],
      "scale": [0.8, 0.8, 0.8],
      "components": [
        { "type": "mesh", "mesh": "viking:rock/0" },
        { "type": "material", "material": "viking:VikingRealmAlt" }
      ]
    },
    {
      "name": "Bush1",
      "position": [-15, 0, -3],
      "scale": [1, 1, 1],
      "components": [
        { "type": "mesh", "mesh": "viking:bush/0" },
        { "type": "material", "material": "viking:VikingRealmAlt" }
      ]
    },
    {
      "name": "Bush2",
      "position": [14, 0, -5],
      "scale": [1, 1, 1],
      "components": [
        { "type": "mesh", "mesh": "viking:bush/0" },
        { "type": "material", "material": "viking:VikingRealmAlt" }
      ]
    }
  ]
}
